{
  "attempts": [],
  "export_id": "exp_b3bc0a87b368955da7df662c4709ea93",
  "firms": [
    {
      "display_name": "example-firm (synthetic)",
      "enabled": true,
      "firm_key": "example-firm",
      "homepage_url": "https://www.example-firm.test/",
      "hosts": [
        {
          "authorisation": "operator_approved_first_party",
          "circuit_state": "closed",
          "content_signals": [],
          "host": "help.example-firm.test",
          "role": "help_center",
          "terms_decision": "allowed",
          "terms_reviewed_at": "2026-10-20T12:00:00.000Z",
          "terms_url": "https://www.example-firm.test/terms"
        },
        {
          "authorisation": "operator_approved_first_party",
          "circuit_state": "closed",
          "content_signals": [
            "search=yes, ai-train=no"
          ],
          "host": "www.example-firm.test",
          "role": "homepage",
          "terms_decision": "allowed",
          "terms_reviewed_at": "2026-10-20T12:00:00.000Z",
          "terms_url": "https://www.example-firm.test/terms"
        }
      ],
      "sources": [
        {
          "canonical_url": "https://help.example-firm.test/hc/en-us",
          "enabled": true,
          "kind": "zendesk",
          "latest_attempt": null,
          "latest_snapshot_id": null,
          "source_channel": "seed",
          "source_id": "src_d48ecd2653373edde00d5132bbb9bac7"
        },
        {
          "canonical_url": "https://help.example-firm.test/hc/en-us/articles/1001-What-is-the-daily-loss-limit",
          "enabled": true,
          "kind": "page",
          "latest_attempt": {
            "at": "2026-10-21T12:00:26.000Z",
            "http_status": 200,
            "outcome": "unchanged",
            "reason": null
          },
          "latest_snapshot_id": "snap_d53e00b3fcd548a2c20f2c3291c9ded5",
          "source_channel": "platform_api",
          "source_id": "src_61ea756cf93b7e6b4ce447a58fee5158"
        },
        {
          "canonical_url": "https://help.example-firm.test/hc/en-us/articles/1002-Payout-eligibility",
          "enabled": true,
          "kind": "page",
          "latest_attempt": {
            "at": "2026-10-20T12:00:08.000Z",
            "http_status": 200,
            "outcome": "new_snapshot",
            "reason": null
          },
          "latest_snapshot_id": "snap_d109793d136e16dad7e85eb8b77e556e",
          "source_channel": "platform_api",
          "source_id": "src_877195d23292b2d8f9738e9258062394"
        },
        {
          "canonical_url": "https://www.example-firm.test/",
          "enabled": true,
          "kind": "page",
          "latest_attempt": {
            "at": "2026-10-21T12:00:36.000Z",
            "http_status": 304,
            "outcome": "unchanged",
            "reason": null
          },
          "latest_snapshot_id": "snap_14659ad2cd47adb4f573eebee4e636c1",
          "source_channel": "sitemap",
          "source_id": "src_64199e8a258d1c9b50ff4dec9c6db706"
        },
        {
          "canonical_url": "https://www.example-firm.test/docs/rulebook.pdf",
          "enabled": true,
          "kind": "pdf",
          "latest_attempt": {
            "at": "2026-10-21T12:00:26.000Z",
            "http_status": 304,
            "outcome": "unchanged",
            "reason": null
          },
          "latest_snapshot_id": "snap_bbea4fea56d81ee24193eb2dda610644",
          "source_channel": "seed",
          "source_id": "src_3ddf67fb97dd860f8a6bf3f8f3be9c7b"
        },
        {
          "canonical_url": "https://www.example-firm.test/evaluation-rules",
          "enabled": true,
          "kind": "page",
          "latest_attempt": {
            "at": "2026-10-21T12:00:26.000Z",
            "http_status": null,
            "outcome": "skipped_lastmod",
            "reason": "sitemap lastmod 2026-10-01"
          },
          "latest_snapshot_id": "snap_346a3ade5d12f759c1c2df6c2ef7017e",
          "source_channel": "sitemap",
          "source_id": "src_0af6d5fd03d27a6284393e110e037e00"
        },
        {
          "canonical_url": "https://www.example-firm.test/faq",
          "enabled": true,
          "kind": "page",
          "latest_attempt": {
            "at": "2026-10-21T12:00:32.000Z",
            "http_status": 304,
            "outcome": "unchanged",
            "reason": null
          },
          "latest_snapshot_id": "snap_fd5fa7d3d136128311ea81c0ccc33b9e",
          "source_channel": "sitemap",
          "source_id": "src_028553446f0b9ec1d4615571730e5449"
        },
        {
          "canonical_url": "https://www.example-firm.test/funded-dashboard",
          "enabled": true,
          "kind": "page",
          "latest_attempt": {
            "at": "2026-10-21T12:00:28.000Z",
            "http_status": 304,
            "outcome": "unchanged",
            "reason": null
          },
          "latest_snapshot_id": "snap_9d8de85a0ae226b3e5cb3c55ca9cf1ea",
          "source_channel": "sitemap",
          "source_id": "src_4c1eb8b0ff4e829a452f84c1bd383fcd"
        },
        {
          "canonical_url": "https://www.example-firm.test/payout-policy",
          "enabled": true,
          "kind": "page",
          "latest_attempt": {
            "at": "2026-10-21T12:00:30.000Z",
            "http_status": 304,
            "outcome": "unchanged",
            "reason": null
          },
          "latest_snapshot_id": "snap_18b77449a8ccaf696646b49faf272bc4",
          "source_channel": "link",
          "source_id": "src_2143acd9a4dbc9586efce369de6b53e6"
        },
        {
          "canonical_url": "https://www.example-firm.test/rules",
          "enabled": true,
          "kind": "page",
          "latest_attempt": {
            "at": "2026-10-21T12:00:24.000Z",
            "http_status": null,
            "outcome": "skipped_lastmod",
            "reason": "sitemap lastmod 2026-10-01"
          },
          "latest_snapshot_id": "snap_551fe743abe1fc1742d5890151855bbd",
          "source_channel": "seed",
          "source_id": "src_9188bc3b45ae8d7509d828665d6e4580"
        },
        {
          "canonical_url": "https://www.example-firm.test/terms",
          "enabled": true,
          "kind": "page",
          "latest_attempt": {
            "at": "2026-10-21T12:00:34.000Z",
            "http_status": 304,
            "outcome": "unchanged",
            "reason": null
          },
          "latest_snapshot_id": "snap_850f99e769a9120770ab366036a97052",
          "source_channel": "link",
          "source_id": "src_6caf522bb3339473e2922ff4e8979106"
        }
      ]
    },
    {
      "display_name": "sample-funding (synthetic)",
      "enabled": true,
      "firm_key": "sample-funding",
      "homepage_url": "https://www.example-firm.test/",
      "hosts": [
        {
          "authorisation": "operator_approved_first_party",
          "circuit_state": "closed",
          "content_signals": [],
          "host": "www.sample-funding.test",
          "role": "homepage",
          "terms_decision": "prohibited",
          "terms_reviewed_at": "2026-10-21T12:00:36.000Z",
          "terms_url": "https://www.example-firm.test/terms"
        }
      ],
      "sources": [
        {
          "canonical_url": "https://www.sample-funding.test/payouts",
          "enabled": true,
          "kind": "page",
          "latest_attempt": {
            "at": "2026-10-20T14:30:00.000Z",
            "http_status": null,
            "outcome": "new_snapshot",
            "reason": null
          },
          "latest_snapshot_id": "snap_07ccb8b3202089003345c43147a7ead1",
          "source_channel": "manual_capture",
          "source_id": "src_a03c46cb6614d91bb091b5f3bdc00934"
        }
      ]
    }
  ],
  "generated_at": "2026-10-20T15:00:00.000Z",
  "kind": "fundedflow.collector.evidence",
  "notice": "Unverified source evidence collected by FundedFlowCollector. Not rules and not verified provider data.",
  "producer": {
    "hash_algorithm": "sha256",
    "name": "fundedflow-collector",
    "normalization_version": "norm-v1",
    "version": "0.1.0"
  },
  "schema_version": 1,
  "snapshots": [
    {
      "canonical_url": "https://help.example-firm.test/hc/en-us/articles/1001-What-is-the-daily-loss-limit",
      "captured_at": "2026-10-20T12:00:08.000Z",
      "content_hash": "sha256:0dbf6ca0095e04a72b64b718db7672fea8ae6578d1241583a4832311bbef2f8f",
      "content_type": "text/html",
      "extraction_warnings": [],
      "fetch_method": "fixture_replay",
      "final_url": "https://help.example-firm.test/hc/en-us/articles/1001-What-is-the-daily-loss-limit",
      "firm_key": "example-firm",
      "headings": [
        {
          "level": 2,
          "offset": 104,
          "text": "When does it reset?"
        }
      ],
      "http_status": 200,
      "links": [],
      "normalization_version": "norm-v1",
      "observations": {
        "first_seen_at": "2026-10-20T12:00:08.000Z",
        "last_seen_at": "2026-10-21T12:00:26.000Z",
        "observation_count": 2
      },
      "parser": {
        "name": "zendesk-api+trafilatura+bs4",
        "version": "trafilatura 2.3.1; bs4 4.15.0; lxml 6.1.3"
      },
      "platform_metadata": {
        "zendesk": {
          "article_id": 1001,
          "edited_at": "2026-10-01T09:00:00Z",
          "locale": "en-us",
          "section_id": 50,
          "updated_at": "2026-10-01T09:00:00Z"
        }
      },
      "raw_sha256": "sha256:7da2457972b46dcf30f0cad9157607734289b784941ae4e01d3c61c5885ab3c9",
      "redirect_chain": [],
      "requested_url": "https://help.example-firm.test/api/v2/help_center/en-us/articles.json?per_page=100&sort_by=updated_at&sort_order=desc",
      "snapshot_id": "snap_d53e00b3fcd548a2c20f2c3291c9ded5",
      "source_channel": "platform_api",
      "source_id": "src_61ea756cf93b7e6b4ce447a58fee5158",
      "stated_dates": {
        "effective_at": null,
        "published_at": null
      },
      "tables": [],